{
  "backend": "isaac-newton",
  "scene_id": "nvidia-hospital-navigation",
  "usd_path": "data/scenes/nvidia-hospital-6.0/source/Assets/Isaac/6.0/Isaac/Environments/Hospital/hospital.usd",
  "provenance_path": "data/scenes/nvidia-hospital-6.0/asset-provenance.json",
  "public_map_path": "data/scenes/nvidia-hospital-6.0/public-map-showcase.json",
  "robot_model": "groundcontact_rollers",
  "observer_renderer": "newton_warp",
  "device": "cuda:0",
  "spawn_pose": {"x_m": 7.96, "y_m": 7.15, "z_m": 0.126, "yaw_rad": 0.0},
  "goal": {
    "kind": "point",
    "target_xy_m": [8.1, 9.4],
    "distance_m": 0.3,
    "hold_ticks": 5,
    "waypoints": [
      {"target_xy_m": [9.7, 7.2], "distance_m": 0.35},
      {"target_xy_m": [9.7, 9.4], "distance_m": 0.35}
    ]
  },
  "task_instruction": "Navigate the furnished hospital using the official roller policy. Visit the east checkpoint at (9.7,7.2), the north checkpoint at (9.7,9.4), then the west destination at (8.1,9.4), in world meters. Use fresh head RGB, simulator-ground-truth wall observations, odometry, ToF and the authored scene map. Measure progress after each bounded metric walk or rotation, account for actual turn translation, and stop upright at the final destination. Preserve native planning and independent final verification.",
  "budget": {"max_control_steps": 12000, "max_wall_time_s": 3600}
}
