{
  "backend": "cpu-mujoco-bam",
  "scene_id": "official-apartment-ball-approach",
  "spawn_pose": {"x_m": -3.65, "y_m": 0.0, "yaw_rad": 0.0},
  "goal": {"kind": "object", "object": "ball_0", "distance_m": 0.5, "hold_ticks": 5},
  "task_instruction": "读取当前相机中的 ball_0，使用 microduck.approach_object 接近它，保持距离所观察表面点 0.4 米，然后停止。",
  "budget": {"max_control_steps": 1000, "max_wall_time_s": 300}
}
