{
  "backend": "cpu-mujoco-bam",
  "scene_id": "official-apartment-ball-tracking",
  "spawn_pose": {"x_m": -3.65, "y_m": 0.0, "yaw_rad": 0.0},
  "goal": {"kind": "object", "object": "ball_0", "distance_m": 0.5, "hold_ticks": 5},
  "task_instruction": "使用 simulator_ground_truth 观察当前相机中的 ball_0，调用 microduck.read_track 查询它的 track_id。使用 microduck.approach_object 接近它，保持距离所观察表面点 0.4 米。完成后使用相同 prompt 和 source 重新观察，调用 microduck.read_track 确认同一个目标的当前测量，然后完成停止保持与正式任务验证。",
  "budget": {"max_control_steps": 1000, "max_wall_time_s": 600}
}
