{
  "backend": "isaac-newton",
  "scene_id": "nvidia-office-6.0",
  "usd_path": "data/scenes/nvidia-office-6.0/source/Assets/Isaac/6.0/Isaac/Environments/Office/office.usd",
  "provenance_path": "data/scenes/nvidia-office-6.0/asset-provenance.json",
  "public_map_path": "data/scenes/nvidia-office-6.0/public-map.json",
  "device": "cuda:0",
  "spawn_pose": {
    "x_m": -17.5500013,
    "y_m": 30.4499995,
    "z_m": 0.125,
    "yaw_rad": 0.0
  },
  "goal": {
    "kind": "point",
    "target_xy_m": [-17.0500013, 30.4499995],
    "distance_m": 0.15,
    "hold_ticks": 5
  },
  "task_instruction": "Use the public scene map and odometry to navigate with the official walking policy to world coordinates x=-17.0500013 m, y=30.4499995 m in the furnished office, then stop while upright.",
  "budget": {
    "max_control_steps": 5000,
    "max_wall_time_s": 1200
  }
}
